Used 2021 Land Rover, Range Rover Westminster SWB, $47,700, Great Price, 57,029 miles, 
Used 2021 Land Rover, Range Rover Velar P250 S, $34,500, Fair Price, 40,730 miles, 
Used 2021 Land Rover, Discovery Sport S, $23,500, Fair Price, 60,536 miles, 
Used 2021 Land Rover, Range Rover SV Autobiography LWB, $107,995, Great Price, 24,673 miles, 
Used 2021 Land Rover, Defender 110 SE, $41,000, Fair Price, 61,743 miles, 
Used 2021 Land Rover, Range Rover Autobiography Fifty Edition SWB, $63,495, High Price, 27,282 miles, 
