Year/Make, Model, Price, Rating, Mileage
Used 2020 Land Rover, Defender 110 HSE, 41990, Excellent Price, 64021, 
Used 2020 Land Rover, Defender 110 First Edition, 44299, Great Price, 68831, 
Used 2020 Land Rover, Discovery SE V6 Supercharged, 25000, Excellent Price, 39030, 
Used 2020 Land Rover, Range Rover Velar P250 R-Dynamic S, 30900, Fair Price, 65169, 
Used 2020 Land Rover, Range Rover Velar P250 S, 25998, Great Price, 52066, 
Used 2020 Land Rover, Range Rover Autobiography V8 Supercharged LWB, 76995, High Price, 39627, 
Used 2020 Land Rover, Range Rover Evoque P250 S, 24500, High Price, 64838, 
Used 2020 Land Rover, Range Rover HSE V6 Supercharged SWB, 40995, High Price, 56126, 
