Year/Make, Model, Price, Rating, Mileage
Used 2021 Land Rover, Discovery HSE R-Dynamic P360, 33000, Excellent Price, 59245, 
Used 2021 Land Rover, Range Rover Autobiography Fifty Edition SWB, 69999, Excellent Price, 37568, 
Used 2021 Land Rover, Range Rover Westminster SWB, 23984, Excellent Price, 110466, 
Used 2021 Land Rover, Defender 110 X, 55998, Excellent Price, 48404, 
Used 2021 Land Rover, Discovery HSE R-Dynamic P360, 33000, Excellent Price, 59245, 
Used 2021 Land Rover, Range Rover Sport HSE Silver Edition Turbo i6 Mild Hybrid, 34729, Excellent Price, 73006, 
Used 2021 Land Rover, Range Rover Autobiography LWB, 59985, Great Price, 55468, 
Used 2021 Land Rover, Discovery Sport SE, 21495, Excellent Price, 53063, 
Used 2021 Land Rover, Range Rover Westminster SWB, 31995, Excellent Price, 83523, 
Used 2021 Land Rover, Range Rover P525 Westminster Edition LWB, 43995, Great Price, 71560, 
Used 2021 Land Rover, Range Rover Evoque S, 25998, Excellent Price, 41376, 
Used 2021 Land Rover, Defender 90 First Edition, 47998, Excellent Price, 18679, 
Used 2021 Land Rover, Range Rover Evoque SE, 26850, Great Price, 47820, 
Used 2021 Land Rover, Range Rover Sport HST Turbo i6 Mild Hybrid, 36000, Excellent Price, 77956, 
Used 2021 Land Rover, Range Rover Sport HSE Dynamic V8 Supercharged, 41500, Great Price, 56660, 
Used 2021 Land Rover, Range Rover SV Autobiography Dynamic SWB, 84995, Excellent Price, 19930, 
Used 2021 Land Rover, Range Rover Velar P400 R-Dynamic HSE, 42500, Excellent Price, 44784, 
Used 2021 Land Rover, Defender 110 X-Dynamic HSE, 56998, Fair Price, 39958, 
Used 2021 Land Rover, Range Rover P525 Westminster Edition LWB, 53950, Fair Price, 52677, 
Used 2021 Land Rover, Range Rover Sport HSE Dynamic V8 Supercharged, 49997, Fair Price, 41842, 
Used 2021 Land Rover, Range Rover Velar P340 R-Dynamic S, 46998, High Price, 19438, 
Used 2021 Land Rover, Range Rover Autobiography SWB, 56250, High Price, 59208, 
Used 2021 Land Rover, Range Rover Sport HSE Dynamic V8 Supercharged, 44495, Fair Price, 50115, 
Used 2021 Land Rover, Range Rover Sport HST Turbo i6 Mild Hybrid, 49995, High Price, 35603, 
Used 2021 Land Rover, Range Rover Evoque S, 24995, High Price, 48975, 
Used 2021 Land Rover, Defender 110 S, 49998, High Price, 36520, 
Used 2021 Land Rover, Range Rover Velar P250 R-Dynamic S, 34499, High Price, 56783, 
