Year/Make, Model, Price, Rating, Mileage
Used 2023 Land Rover, Defender 110 Carpathian Edition, 78900, Excellent Price, 49853
Used 2023 Land Rover, Range Rover Evoque R-Dynamic S, 34000, Excellent Price, 31696
Used 2023 Land Rover, Discovery Sport S, 28784, Excellent Price, 30875
Used 2023 Land Rover, Range Rover Sport SE, 65900, Great Price, 42928
Used 2023 Land Rover, Range Rover P400 SE SWB, 82800, Great Price, 46691
Used 2023 Land Rover, Range Rover Sport SE Dynamic, 77400, Great Price, 26390
Used 2023 Land Rover, Range Rover Velar P340 R-Dynamic S, 43900, Great Price, 58685
Used 2023 Land Rover, Range Rover P530 SE SWB, 112900, Fair Price, 7123
Used 2023 Land Rover, Range Rover Evoque R-Dynamic S, 37900, Great Price, 26749
Used 2023 Land Rover, Range Rover P400 SE SWB, 92900, Fair Price, 25881
Used 2023 Land Rover, Range Rover P400 SE SWB, 97400, High Price, 31034
Used 2023 Land Rover, Discovery P300 S R-Dynamic, 41164, Great Price, 31955
Used 2023 Land Rover, Defender 90 X, 71977, Excellent Price, 5005
Used 2023 Land Rover, Defender 90 75th Edition, 66900, Fair Price, 1952
Used 2023 Land Rover, Range Rover First Edition LWB, 117900, High Price, 55263
Used 2023 Land Rover, Range Rover Sport SE Dynamic, 77900, Fair Price, 24380
