Year/Make, Model, Price, Rating, Mileage
Used 2022 Land Rover, Range Rover Autobiography SWB, 86995, Excellent Price, 14175, 
Used 2022 Land Rover, Range Rover Sport HSE Dynamic V8 Supercharged, 52995, Excellent Price, 55717, 
Used 2022 Land Rover, Range Rover Sport HSE Silver Edition Turbo i6 Mild Hybrid, 50995, Great Price, 46096, 
Used 2022 Land Rover, Discovery HSE R-Dynamic P360, 45995, Excellent Price, 35918, 
Used 2022 Land Rover, Range Rover Sport HSE Silver Edition Turbo i6 Mild Hybrid, 55995, Great Price, 38378, 
Used 2022 Land Rover, Range Rover Sport HSE Silver Edition Turbo i6 Mild Hybrid, 56995, Fair Price, 34075, 
Used 2022 Land Rover, Defender 110 XS Edition, 60995, Great Price, 33646, 
Used 2022 Land Rover, Range Rover Velar P250 S, 46995, Fair Price, 16169, 
Used 2022 Land Rover, Range Rover Velar P250 R-Dynamic S, 49995, High Price, 17883, 
