Year/Make, Model, Price, Rating, Mileage
Used 2023 Mitsubishi, Outlander Plug-In Hybrid SE S-AWC, 21479, Excellent Price, 71472
Used 2023 Mitsubishi, Outlander SE FWD, 14420, Excellent Price, 140838
Used 2023 Mitsubishi, Eclipse Cross SEL S-AWC, 23658, Great Price, 6504
Used 2023 Mitsubishi, Outlander SE Black Edition S-AWC, 23227, Great Price, 39960
Used 2023 Mitsubishi, Outlander SE S-AWC, 21420, Great Price, 61692
Used 2023 Mitsubishi, Outlander SE S-AWC, 21920, Fair Price, 52111
Used 2023 Mitsubishi, Outlander Plug-In Hybrid SE S-AWC, 26400, Excellent Price, 50615
Used 2023 Mitsubishi, Outlander SE S-AWC, 26991, Great Price, 17538
Used 2023 Mitsubishi, Outlander Plug-In Hybrid SEL S-AWC, 26387, Excellent Price, 44242
Used 2023 Mitsubishi, Mirage G4 ES Sedan, 10495, Great Price, 28805
Used 2023 Mitsubishi, Outlander Plug-In Hybrid SEL S-AWC, 24995, Great Price, 58334
Used 2023 Mitsubishi, Eclipse Cross SEL S-AWC, 19624, Fair Price, 49868
Used 2023 Mitsubishi, Outlander SE Special Edition S-AWC, 21420, Fair Price, 61325
Used 2023 Mitsubishi, Outlander SE FWD, 27998, High Price, 19931
Used 2023 Mitsubishi, Outlander SE Black Edition FWD, 26998, Fair Price, 23905
Used 2023 Mitsubishi, Outlander SE Special Edition FWD, 21846, High Price, 53990
Used 2023 Mitsubishi, Mirage G4 Black Edition Sedan, 13420, High Price, 68544
Used 2023 Mitsubishi, Outlander ES FWD, 20995, High Price, 70812
