Year/Make, Model, Price, Rating, Mileage
Used 2020 Land Rover, Range Rover Sport HSE Turbo i6 Mild Hybrid, 38994, Excellent Price, 35664
Used 2020 Land Rover, Discovery SE V6 Supercharged, 25000, Excellent Price, 39030
Used 2020 Land Rover, Range Rover Sport HST Turbo i6 Mild Hybrid, 36524, Excellent Price, 58479
Used 2020 Land Rover, Defender 110 HSE, 41990, Excellent Price, 64021
Used 2020 Land Rover, Range Rover Sport HSE Turbo i6 Mild Hybrid, 29990, Excellent Price, 74771
Used 2020 Land Rover, Defender 110 HSE, 43222, Excellent Price, 52881
Used 2020 Land Rover, Range Rover Autobiography V8 Supercharged LWB, 76995, High Price, 39627
Used 2020 Land Rover, Range Rover Evoque P250 S, 20700, High Price, 70657
Used 2020 Land Rover, Range Rover Evoque P250 SE, 26990, High Price, 55917
Used 2020 Land Rover, Range Rover HSE V6 Supercharged SWB, 40995, High Price, 56126
