Used 2021 Acura, TLX SH-AWD with Advance Package, $30,997, Excellent Price, 39,308 miles, 
Used 2021 Acura, TLX SH-AWD with Advance Package, $30,997, Excellent Price, 39,308 miles, 
Used 2021 Acura, RDX SH-AWD with A-Spec Package, $34,998, Great Price, 21,861 miles, 
Used 2021 Acura, TLX FWD with Technology Package, $24,000, Excellent Price, 86,817 miles, 
Used 2021 Acura, RDX SH-AWD with A-Spec Package, $33,998, Fair Price, 43,284 miles, 
Used 2021 Acura, RDX SH-AWD with Technology Package, $24,500, Great Price, 97,239 miles, 
Used 2021 Acura, RDX SH-AWD with Technology Package, $29,500, Fair Price, 48,330 miles, 
