Year/Make, Model, Price, Rating, Mileage
Used 2021 Acura, TLX SH-AWD with Advance Package, 30997, Excellent Price, 39308, 
Used 2021 Acura, RDX SH-AWD with A-Spec Package, 31990, Excellent Price, 45772, 
Used 2021 Acura, TLX SH-AWD with Advance Package, 30997, Excellent Price, 39308, 
Used 2021 Acura, RDX SH-AWD with A-Spec Package, 34998, Great Price, 21861, 
Used 2021 Acura, TLX FWD with Technology Package, 23854, Excellent Price, 86817, 
Used 2021 Acura, RDX Standard FWD, 26900, High Price, 55929, 
Used 2021 Acura, RDX SH-AWD with Technology Package, 24250, Fair Price, 97239, 
