Year/Make, Model, Price, Rating, Mileage
Used 2019 Acura, RDX FWD with Advance Package, 15000, Excellent Price, 182192, 
Used 2019 Acura, RDX FWD with Advance Package, 17990, Excellent Price, 127512, 
Used 2019 Acura, MDX SH-AWD with Technology Package, 22000, Great Price, 103545, 
Used 2019 Acura, RDX SH-AWD with A-Spec Package, 22900, Fair Price, 110964, 
Used 2019 Acura, RDX SH-AWD with Technology Package, 25998, High Price, 78956, 
Used 2019 Acura, RDX FWD with A-Spec Package, 28400, High Price, 62297, 
