Used 2024 Acura, Integra A-Spec Technology Package CVT, $29,924, Excellent Price, 7,062 miles, 
Used 2024 Acura, MDX Type S Advance Package SH-AWD, $64,995, High Price, 18,590 miles, 
Used 2024 Acura, RDX A-Spec Advance Package, $43,839, Great Price, 1,453 miles, 
Used 2024 Acura, MDX Advance Package SH-AWD, $49,493, Excellent Price, 12,203 miles, 
Used 2024 Acura, RDX A-Spec Advance Package, $42,673, Excellent Price, 12,249 miles, 
Used 2024 Acura, RDX A-Spec Advance Package, $41,773, High Price, 44,675 miles, 
Used 2024 Acura, RDX A-Spec Package, $39,996, High Price, 8,563 miles, 
